{"blocking_reason":"none","bootstrap_imports":[{"dependency_id":"AF","path":"governance/imports/axiomatic-fundamentalism.pdf","sha256":"2ca94a78ee80476bc7dadd367a47a40be5bd5fd54bcb446f27f9cbae0b5572a6","status":"legacy_bootstrap_hash_locked_noncanonical_fallback"},{"dependency_id":"AFC","path":"governance/imports/afc-main.zip","sha256":"24587c1ddd7dd5b7673795adf97954a3b40e6480fef54a9d8917e6d77ac0b950","status":"legacy_bootstrap_hash_locked_noncanonical_fallback"},{"dependency_id":"GM","path":"governance/imports/general-mechanics-1.0.5.0.zip","sha256":"5d9171e1b4518d975ad3486aaa6d09a781cc60877a950cc0a23da157c37c4736","status":"legacy_bootstrap_hash_locked_noncanonical_fallback"},{"dependency_id":"AOD","path":"governance/imports/aod-stable-baseline-v40.03r17.1.json","sha256":"b9f46efcb5ae52fdcca8c2f502815fb472f9b5d50e83eb119ce09394c1f0f680","status":"legacy_bootstrap_hash_locked_noncanonical_fallback"}],"candidate_release":"v40.04r03","canonical_lock_path":"governance/UPSTREAM_RELEASE_LOCK.json","canonical_lock_present":false,"fallback_claims_latest":false,"fallback_mode":"bootstrap_hash_locked_until_first_successful_refresh","fallback_snapshot_path":"governance/UPSTREAM_FALLBACK_SNAPSHOT.json","fallback_snapshot_sha256":"07308a3f2cc0c8181de17bf33fe41c127241ffb760ac0655334e32071777d6fe","go_blocking":false,"go_eligible":true,"latest_locator_semantics":"authoring_discovery_resolved_snapshot_frozen_per_candidate","refresh_attempt_evidence":"GitHub latest-release refresh unavailable: URLError: <urlopen error [Errno -3] Temporary failure in name resolution>","refresh_attempt_receipt_path":"governance/UPSTREAM_REFRESH_ATTEMPT.json","refresh_attempt_receipt_sha256":"ef30ad4d4e23ce497dc8d0497108c70c2f61ed9f6584ff45552f3ad8c4c3972b","refresh_attempt_status":"attempted_network_unavailable_fallback_active","refresh_mode":"always_attempt_latest_on_authoring","required_next_operation":"REVIEW_candidate_scoped_refresh_receipt_and_complete_fallback","schema_version":"3.1","status_id":"AOD_UPSTREAM_RELEASE_LOCK_STATUS","validation_mode":"strict_lock_when_present_or_explicit_nonblocking_fallback"}
